id,full_name,short_name,status,contact,email,phone,description
1001,Leoproin Bibendumin Philosophia,Tirerdneh Idvestibulum,ACTIVE,Cubilia Aila,disputationi.ullamcorpersed@consequat.com,181-4273-2875,Muretla molestiemauris commodoius an exnec phasellus hismagna molestiemauris maemiv erinevnoc. 
1002,Naeneasubipad Quis Fabellas,Arcu Soretec,ACTIVE,Eativ Aliquip,enoiger.periculis@sutceledsui.com,187-7494-4034,Desreprocmallu maemiv oitseauq ninasmucca murolod oud petentium rotrot netus ipsum. 
1003,Orci Idneiciffe Maitneuqole,Maid VariusLorem,ACTIVE,Consectetur Cenxe,mel.fermentum@tnesse.com,165-1854-1592,Ea rutecsan posuerein sarcangam causae rumatu arotil rep appetereid omnium. 
1004,Seicirtlu EuqsetnelleP Dictumstquisque,Hinc Nominavi,ACTIVE,Teravui Inermis,rutecsan.miv@mollissed.com,148-3630-9757,Nullam mea euqsiuQ surup Suspendisse netus rep voluptaria muinodisop siruamsutcul. 
1005,Persequeris Susir Nimutcid,Orev It,ACTIVE,Equidem Mauq,ortson.euqsiuqoel@ludus.com,150-9036-5769,Alugil diman mulubitsevtse variussed euqsilauq muinodisop justodonec masucca tale cenodsullet. 
